id,date,user_name,rating,title,content
12763875334,2025-06-11 17:42:51-07:00,loserofgames,5,one flaw,it doesn’t give you the calories burned from your steps that they track. this should be done automatically. instead you have to log it in yourself. i don’t see how you can do it after the fact.
12763805299,2025-06-11 17:13:17-07:00,gsellea,4,analysis gone,i absolutely love this app and feel it is only reason i am able to not only lose but maintain weight. the only issue i have currently is that the analysis portion of the weekly summary is completely gone. it was my favorite and made me feel super accomplished by end of week. hope this gets fixed soon!
12762870011,2025-06-11 11:11:24-07:00,lovelovemovies,1,erroneous tracking info,"i have bought the app and have been using to track my overall calories and nutrition intake.  it gives erroneous results for many vitamins and minerals, like consistent zero readings, such as b12 and b6 in my case.  gives a zero reading for b12 when i know that i had plenty of steak?!! i guess you have to go premium and pay a monthly fee to get a proper reading.  i already purchase and paid fully for this app a while ago, they do update it but still zero reading for a bunch of vitamins and minerals.  i have no reason to get their monthly subscription since i already purchased the app.  so i have to put up with very unsettling readings on this app.  something to think about."
12760427515,2025-06-10 20:05:17-07:00,nanbazan,5,my diary app is really great,i really enjoy this app as a person who uses a manual wheelchair find the step mode in this app to be the most accurate so far i have not tried a smart watch. i don’t like to wear a watch so this app has worked great for me so far. also has some other features. i did get the prime membership because the ai feature is amazing.
12759007716,2025-06-10 10:57:15-07:00,squirrelygirl37,5,detailed and comprehensive! yet easy to use!,detailed and comprehensive! yet easy to use! you can log just the basics or get really into it with detailed controls. the premium version has an extensive recipe section that is really good and well worth the upgrade!
12757967394,2025-06-10 05:51:31-07:00,poseidon 80,5,great tool,"helps track calories, easy to use, connects to smart scale to track weight-loss."
12756597325,2025-06-09 20:31:23-07:00,rodeobarbie,5,absolutely love it!,easy to use. so simple to follow a good diet regime with this app! scanning and entering food is a breeze and the weight loss tracking is second to none! i recommend it highly.i have reached my target weight and i am now maintaining it. i lost 13% of my bodyweight and have had no trouble keeping it off!
12756492291,2025-06-09 19:46:12-07:00,buddie fly,5,awesome,"i was looking for a new app. to help me keep track of everything.
this app covers everything that was i was hoping for and more.  i did get the premium and it’s worth it to me.  i like the different choices of entering food items when need to enter quick. i can use the ai it’s decent for accuracy  ."
12752779608,2025-06-08 20:38:14-07:00,stupid scale,5,review,great app for tracking everything.
12752359001,2025-06-08 17:40:58-07:00,washarry,2,"update, not improvement","i can no longer simply swipe to copy yesterday’s breakfast to today. it’s the same for all meals. 

that was the one feature that made the app near perfect. now, it’s really disappointing and much more difficult for someone keeping to a structured diet reusing a small group of ingredients at a time. 

please fix this!"
12751935846,2025-06-08 14:45:31-07:00,embdp,5,lost five lbs in one week,this app is amazing in just one week ive lost 5 lbs. i really struggle with eating unhealthy food and this app makes it wow way to pick the healthier options. i love that you don’t have to pay for the barcode function and the app already has so many meals or food items listed that it eliminates the annoying part of trying to figure out how many calories are in all your food. i recommend to anyone who has trouble losing weight and needs an indicator or even for those trying to gain weight
12751376492,2025-06-08 11:24:35-07:00,n8vz,5,impressed so far!,"after only one day, i’m impressed with your app compared to lose it that i was using previously.  lose it helped get from 189 to 177 part way to my 165 goal, but it was very buggy.  it would periodically stop subtracting calories in my food from the daily allotment, thus becoming useless.  i was able to fix this several times by uninstalling and reinstalling, but when it happened again yesterday, i decided to find a new app. 

so far your app seems more complete than lose it, and i like the ai feature for photographing a meal to get an estimate of its calories. however, it does need some tweaking.  for breakfast this morning i had a bowl of cereal with blackberries on the top.  it correctly identified the component and came up with a calorie estimate for “miniwheats, blackberries and milk” which seemed fairly accurate.  however, it then proceeded to add each ingredient in again separately, thus doubling the total.  i was able easily to delete the duplication, so no harm no foul.

as they say in congress, i’ll revise and extend my remarks after i have more experience with this app.  maybe one i reach my 165 goal, which is scheduled for the first week of august."
12750882707,2025-06-08 08:50:32-07:00,johnnovia,4,daily food groups,"pretty good…if you added the ability to track recommended servings of daily food groups (dairy, protein, vegetable, fruit, grain, whole grain, other, i would upgrade to the premium account. i am currently adding this info to the notes section in a way that allows me to see daily results in a makeshift table. i add the number in front of the letters that represent the food groups as i complete a meal. see the first row below. the automatic insertion of a period after 2 taps of the space bar is less than ideal. i participated in a 16-week diet program called lifesteps where the concepts were developed 20+ yrs ago but there is no app to assist in sustaining the concepts making it too hard to follow by paper. the mydailyplate.gov site doesn’t have an app either. your app could fill the gap for people who want to track food groups and macros.

b fast     1d    1p    0v   0f    0g    2wg    1o
lunch    d    p    v   f    g    wg    o
dinner   d    p    v   f    g    wg    o

s1           d    p    v   f    g    wg    o
s2           d    p    v   f    g    wg    o
s3           d    p    v   f    g    wg    o"
12748234940,2025-06-07 16:15:33-07:00,fbnazicontrollers,1,very confusing,very confusing 😡
12744031789,2025-06-06 14:20:54-07:00,broadchippy,5,best tracking app,"of all the calorie tracking apps i’ve used mynetdiary has some of the best features and most enjoyable interfaces to use. not only is the paid version cheap compared to other apps, but the free version has every feature you could ask for if you’re looking to have extremely accurate macros and reach your goals."
12741376704,2025-06-05 22:25:18-07:00,kckmari,5,best app ever!,"i’m not one to make reviews, but i love this app. it has helped me stay consistent and honest with my weight loss journey. mynetdiary makes keeping track of your journey easy, it helps explain what everything means for beginners and gives so many options on what works best for you!"
12741141205,2025-06-05 20:36:01-07:00,shdjdndu,5,awesome tool!!,makes tracking calories and planning intake amazingly easy!
12739296135,2025-06-05 08:58:24-07:00,lin6313,5,the best program!,easy to use and an accurate!
12738515952,2025-06-05 05:15:52-07:00,lilithe666,3,ridiculous,every calorie counter app what so ever makes you pay for a premium just to change the little things. exactly why i left myfitnesspal.
12736731765,2025-06-04 16:40:26-07:00,rhinodriver,2,good but annoying,"two things. it’s way easier to estimate volume than weight. please update portion sizes to always include cups, liters in addition to ounces. 

also, the app bugs you multiple times each interaction to upgrade to paid. way too many asks. very irritating."
12736421680,2025-06-04 14:33:13-07:00,flash2427,5,the sublime,"this is the most comprehensive app i have ever seen ! 
every time i think i’ve seen it all, there’s more. excellent"
12736160702,2025-06-04 12:54:47-07:00,pajaroh,1,makes you feel shameful,it’s a good tracker but i am developing an eating disorder
12736115425,2025-06-04 12:38:38-07:00,houfrz,5,i never thought i ate so much.,"i never could understand why i couldn't lose weight. then one day i started tracking my food on the app ""mynet diary"" and i could not believe the amount of calories i was consuming. just a little grazing here and there really builds up. i also love that it has a fasting tracker. i canceled my other subscription and use my net diary for everything."
12733142981,2025-06-03 18:10:13-07:00,🤪😊😮🐈‍⬛🐈‍⬛👀,5,best calorie app,loving this app i’ve used others and this one is by far the best one i’ve found.
12733043679,2025-06-03 17:29:35-07:00,doubble tap,5,great app!!!,done a phenomenal job keeping me on track with my calorie intake. halfway to weight goal already. huge help when cubing portion sizes. definitely worth your time if you are trying to be more fit.
12732538101,2025-06-03 14:02:27-07:00,avacat yayay,4,helpful suggestion :d,"i love this app! it has everything i need, and even the free version is very helpful. i think it would be even better if it took different disorders etc. into account. i personally have pcos, so i’m going to need less calories than what the app gives me. if it could adjust calories depending on any disorders etc. i think that would be awesome."
12732432326,2025-06-03 13:22:25-07:00,folgore1962,5,best food tracking app!,"this is a great app for staying with your diet plan.  it can be easily optimized to support whatever type of diet you want to follow:  keto, carnivore, vegetarian, etc. the database is very comprehensive.  the ai food analysis is great when you’re eating out and need a decent estimate of the calories you’re taking in.  it also provides numerous helpful articles on nutrition and recipes as well."
12727962717,2025-06-02 09:36:49-07:00,frustrated 1600,3,nice but lacking,"i like the app for the most part but i don’t like how i can’t customize restaurant items. when i get coffee out, i always get skim milk when available. if that is not available i use almond or oat milk. the app assumes i use whole milk which increases the cholesterol level. the app also assumes i only care about calories and losing weight. eating healthy is not only about calories."
12727551053,2025-06-02 07:33:03-07:00,cheryl822,5,mynetdiary,it’s the easiest tracking app i ever used i’m using free one right now when there’s a special i will get the pd one i believe
12727117323,2025-06-02 05:20:10-07:00,fitfor85,5,love it!!!,"i absolutely love this app and all it has to offer.  i can eat my favorite foods and stay within my goal, love it without feeling guilty!  the bonus for me is the ai features.  scan
 a food without the barcode and it gives me a good estimate of the caloric value.  integrates nicely with my oura ring and have lost weight nicely."
12726985360,2025-06-02 04:35:41-07:00,empathy dieting,5,capitalism vs dieting,"why are numerous features on your app,  “pay only”aka “premium”subscription dictated by money? c’mon help everybody achieve feel good results while dieting."
12724105108,2025-06-01 09:36:30-07:00,nickel and dime222,3,"good for android users, not the same for iphone users.","i may re review but the app isn’t as good on an iphone, my boyfriend has it on android and there’s way more features and it’s easier to use. example is the hamburger in the upper left corner for him gives him tons of options for information.  mine gives me settings, review the app, frequent questions, and share the app.  just not as easy to get to the information you want.  so if you have an iphone don’t be fooled into believing that if you buy the premium version you will get the same app as your android friends."
12721140341,2025-05-31 15:36:29-07:00,cambriaone,5,impressed … & i have tried many,very happy with tracking tools and range of food database. tracking is the key. i have lost 9 pounds first month.
12720088461,2025-05-31 09:30:19-07:00,bob01568,3,it works but hard to navigate,"the app works if you use it. however, it is really hard to navigate. a week of manually adding recipes i found the url import yesterday. this morning went to add another and can’t find the link. i wish the “customization” on the dashboard would allow me to add any section of the app."
12719693047,2025-05-31 07:37:36-07:00,shar***,3,could be better,"i like that i can scan my food in, but some of the features could be better. like the guy on the wright chart. it would be nice if it showed where you started as he makes his at down the hill. also it should show pounds lost rather than new weight."
12717537233,2025-05-30 18:07:44-07:00,jdavis739,4,.,i just wish there app showed my starting weight on the chat
12717399895,2025-05-30 17:14:01-07:00,dojhevstzgwbwison,4,very easy to track calories,this app can very well be used without paying. it is a super easy way to track calories i can just put in the food i eat and it gives me the exact food. i love it.
12715949866,2025-05-30 08:39:04-07:00,drag receive,5,weight loss,this app has helped me loose so much weight i went from being 138 to 112 in 4 months (5 foot 8 inches ) totally worth downloading
12715445951,2025-05-30 06:16:09-07:00,enjoying the journey girl,5,try the recipe feature,"lost my lengthy review when i accidentally tapped some key on my phone so this is short! try the recipes feature! delicious easy, and fast! you can also make enough for a whole family of four or if you’re like me, use the vacuum sealer to freeze dry some portions for another day when i don’t have time to cook. i love to cook so this journey for me has been very easy, although challenging at the beginning, as i got used to the disciplines that this app invites you to learn. that said, the recipes are terrific and you should try them! i did and i got to goal!"
12715402414,2025-05-30 06:03:19-07:00,reenroy,5,love this app,tracks every from unusual foods to fitness
12713627331,2025-05-29 17:55:04-07:00,shara16,5,my best accountability buddy,i am so glad i found this app .it has helped me to get back on track with my exercise and eating habits without fad or crash diets . highly recommend it . worth every penny
12713355006,2025-05-29 16:02:57-07:00,fark cuckerberg,1,mind of its own,i want to like this app but am not sure how to contact the people in charge. the app has some issues like when i try to type the word “beam” and it automatically changes it to “bean” which i am not trying to look up. there is no work around for this
12710083428,2025-05-28 20:09:47-07:00,ai is so cool,5,the best,"this app is the best app i have ever used for controlling my macro intake. my favorite part is using the ai option. i was skeptical at first, but after using it for a few weeks, it has been surprisingly accurate."
12709504841,2025-05-28 16:13:23-07:00,rilosche,5,unbelievable app,"hey doctor, mr md, can you tell me what’s ailing me?  he said a high aic.  take this class to lose weight, find an app to help. this app is so close to the class.  get the premium, track with it, read the accompanying short, concise articles.  try the recipes.  change your lifestyle, get your health back. life is good, so is this app, enjoy it."
12707672292,2025-05-28 05:52:11-07:00,azsmidee,4,tried it,wish it wasn’t so expensive on limited income
12706889123,2025-05-28 00:50:18-07:00,kahnig,4,great app for tracking diet and health,"i love this app for the most part. it is the best i have used for tracking foods i eat, nutrition, exercise, weight, and other health related data. my only criticism is the part of the app that documents fasting. it isn’t very intuitive and needs to allow more flexibility in correcting entry mistakes and in when you can add a start and stop time relative to the time you are making the entry. i am a planner and if i choose when i am going to start a fast ahead of time, i am more likely to stick to it. this doesn’t allow me to do that."
12706428274,2025-05-27 21:08:13-07:00,joelcass3412,5,great,i hated tracking calories with other apps wasn’t easy and did not like it. but this app actually made tracking calories fun
12702024951,2025-05-26 16:16:39-07:00,augustasher,4,great app but..,this is a great app but it has a lot of premium things so you can’t do everything on the app and it changes how much calories you want to consume in a day also the goal date you want to have lost a certain amount of weight.
12701256686,2025-05-26 11:27:14-07:00,caylahwest,5,great. simple.,"it’s great for keeping up with calories if you’re planning on keeping up with them. i highly suggest getting a food scale to go with this for more accurate measurements. there is the ai food scan and it’s pretty accurate at reading what the food are, but it’s normally pretty off of the food weights at first. you might have to train the scanner for a while in the beginning by correcting the weights of the foods. the app also doesn’t seem to want to be responsible for any calorie deficits under 1400 calories which i can kind of understand as well. so take that with a grain of salt. you can still do what you want but it will give the appropriate warning for the beginners who may be unaware and going into some unhealthy eating habits."
12701203281,2025-05-26 11:09:48-07:00,ingram jonathan,5,great app,"love the app! 
it’s extraordinarily frustrating that i have sent multiple products to be added with photos and information with no response, the app is very difficult to add products yourself especially ones that may have multiple ingredients, especially vitamins. this should be addressed."
12700879219,2025-05-26 09:29:50-07:00,healthaholic1,4,it’s super easy to use and fun,but it is annoying that you need premium for the ai meal scans but other then that it helps me a lot and i love the community
12700083490,2025-05-26 05:37:37-07:00,onechucksmitty,2,not recommended,"the virtual coaching needs to be improved. if you know nothing about macros and calories calorie counter will not teach you correct or useful information. the constant updates to a meal plan that change desired target dates were not necessary and confusing. the ai system used in food photos was okay but regularly needed corrections. this app will help you lose weight and provide you a plan that you can follow with relative easy. you will not learn correct food behaviors or gain truthful knowledge regarding health, fitness, and food which will lead to weight gain when you are done using the app."
12698680795,2025-05-25 19:21:42-07:00,regret20211,1,regret my choice,i have reached out for support and no one ever gets back to me!  very poor customer service.
12698548845,2025-05-25 18:24:54-07:00,alext2963,5,exactly what i need for carbs,"so far this app is working great. i’m still trying to figure it out, but this is exactly what i need for being a diabetic.  it quickly scans bar codes and allows you to choose the exact portions or amounts of food you eat. great way to stay on top of what you’re eating"
12697589559,2025-05-25 11:56:24-07:00,summer69,5,eye opener!,"this app was really an eye opener to what i was eating. it’s a great app that provides so much information, a great community for support and tips, plus recipes. already lost a few lbs the first week. but, had i not gotten the 50% disc, i might not have subscribed due to the cost being so much. great app!"
12697033966,2025-05-25 09:00:51-07:00,gael7,5,easy to keep track,this app enables me to have success with tracking.
12696935043,2025-05-25 08:31:52-07:00,roxannemiracle,5,effective and simple to use,"i haven’t dieted in 25 years and i had a target of losing 5 pounds before vacation. i’m ahead of my goal and it’s helped me realize where my calories (and protein) are coming from. if nothing else, it brings an awareness to my consumption. great and super simple to use. love the ai tool."
12696773180,2025-05-25 07:45:42-07:00,mt. sal,5,does it all!,"this app offers different diets with recipes and intermittent fasting. tracks nutrition,water, exercise. i love!"
12695018347,2025-05-24 20:53:54-07:00,rubia rosa,5,so far so good!,i haven’t lost any weight yet. but not giving up. this really is a cool app.
12693711434,2025-05-24 12:12:13-07:00,justice-op,5,amazing food tracking app!,i really enjoy this app and it has been super helpful in my weight loss journey.
12693377086,2025-05-24 10:23:09-07:00,cbutfor you,3,stop with the coach ads,"everytime i click on anything i get your coach advertising 
annoying!"
12689930066,2025-05-23 13:43:54-07:00,hi!1254,5,awesome,works great for weigh gain to!
12689602198,2025-05-23 11:48:34-07:00,clownlord,5,free scanner,"i used myfitnesspal a few years ago to track calories on a weight gain journey. the barcode scanner was the best part of the app and now it is a paid service. this app has a lot of free useful features, including the barcode scanner. a free barcode scanner is crucial for me because it makes it fast and easy to log a meal or snack without having to search through similar products."
12689599110,2025-05-23 11:47:33-07:00,19chelsea.99,5,best calorie counter there is,this app has helped me lose weight and be able to track my calories by just taking a picture of my meal!
12689470122,2025-05-23 11:04:30-07:00,it's goid,5,better than other apps (free version as well),"i’ve tried a lot of different calorie tracking apps and this one has literally been the best. i recently just bought the premium version as well and it’s so worth it.
i’ve been tracking macros for the past five years now so at this point tracking is like second nature to me so having an app that makes it easy and learns my foods is super important. this is the first time i’m leaving a review for an app, but i just love this app so much that i had to show some support."
12688305407,2025-05-23 05:24:06-07:00,slovannaga,5,i love mynetdiary app!,"i love mynetdiary app! it has never been so easy to track all of the factors that go into trying to live a healthier lifestyle which includes, for me, losing weight, increasing exercise, drinking enough water & keeping track of my meals and intermittent fasting. i never h th ought i could do intermittent fasting but the app helps keeps me on schedule and accountable."
12683340539,2025-05-21 21:20:37-07:00,hdxhdududikv,5,best option,"i have used many different apps and ways to track food this is by far the best for both free and paid versions you will find everything you need. it’s so easy and accurate and i love the app. it’s user friendly and learning your way around is fast. unbelievable amount of options, really glad i used this app."
12681263675,2025-05-21 08:08:49-07:00,tubbyrock,5,need a little more detail,"when it has graded items that are low, can they mark it in red and show us why it’s low so we can look out for it in the future be like oh well too much sodium and it’ll be marked in red or something like that that’ll be great"
12680694731,2025-05-21 05:18:41-07:00,will-won't,1,poorly done app,"their math is often wrong when you look at blocks of days. you used to be able to run comprehensive reports, that seems to be gone. many foods in their database only have calories but no or just a few of the macros and vitamins. for example, there’s practically no data ever for soluble fiber, so you can’t track it. the list of things it doesn’t provide or do adequately is long. it’s a shabby app, frustrating and disappointing and limited."
12673940568,2025-05-19 08:21:52-07:00,great for a second language,5,awesome app,"i’ve have been trying for years to find the perfect app to track my daily food macros and nutrition . i started with the free version and i got the pro version a couples of months ago and absolutely love it . easy to log the food , it gives you the nutrition value of them and a lot more , i have zero complaints and i recommend it to friends."
12670786978,2025-05-18 10:39:02-07:00,em! 😝,5,great app!,"has all the basic functions you need, just wish there were less premium only features, not sure how they stack up compared to other apps as this is the first one ive used. but if you’re mainly just trying to track calories and workouts i would recommend. you can link it with apple health too"
12670608195,2025-05-18 09:41:46-07:00,jmcapecoral,5,great app,"best app i have ever used.  i use it every meal and i have lost over 40 pounds.  the new ai feature makes it even better.  and if you get stuck on something, send them a support request. they are very prompt to respond."
12669994127,2025-05-18 06:37:20-07:00,lelu55,5,love this app,"so easy to use and intuitive.   tracking food with this app has helped me loose weight and understand foods that i am eating much better.   
also, love the fact i have been able to reduce other apps due to the many options within this app. 
my net diary has awesome support staff, very helpful."
12668442493,2025-05-17 20:13:21-07:00,bwolf10,5,thank you!!,"this is the only thing i’ve done that has worked. so far, 17 pounds down! it only works if you use it and consistently enter your food of course, but it has been an easy addition for the reward of finally getting healthy."
12667375693,2025-05-17 12:48:13-07:00,rapidrev1050,5,app,has helped me get off blood pressure mediciation by monitoring my intake!!
12667155315,2025-05-17 11:29:02-07:00,h honest feedback,2,like the older version better,older version was much more user-friendly. too many clicks to get to the lunch breakfast dinner.
