id,date,user_name,rating,title,content
8523852405,2022-04-02 09:17:16-07:00,Userfrom Austin,4,Very underrated,"I think I found this app before The Most Popular fitness tracker gained so much traction, and tbh this app is still superior. The UI is so easy for me to navigate, it’s affordable, and the database of food has grown so much. I also love the long list of different types of exercise, and even though estimating calories burned is not an exact science, I appreciate any ballpark number of extra calories that I need to eat so I don’t hurt myself. Seriously, I tried these other, more talked about apps, and I just don’t want to quit this one. It’s not freaky and aggressive in its wording about sticking to diets and militant exercise and cult-like branded phrasing, and the orange, yellow, and earth tone colors are more pleasant. I also love that it gives you a flexible target date, so you can also set your goal based on the number of calories you want to eat per day. (I like smaller calorie deficits.) Also, bravo for the warnings about going below 1200 calories! Keep being responsible, please!

EDIT: I just deleted a star because I saw below what data they are collecting. Dude, collect my subscription money. Don’t invade my privacy like this. There is no reason to know my contacts, etc. Also, this shouldn’t be an app for ages 4+. Toddlers don’t need to diet. Kids and teens should not be encouraged to diet either given the statistics on the body dysmorphia and eating disorders they develop for life. Thanks!"
8510728173,2022-03-29 22:04:22-07:00,George_S_,1,Permanent accounts and cannot unsubscribe,Do not sign up for this app. I’ve sent at least 4 emails now trying to unsubscribe and delete my account with no response- it’s been almost  one month. No phone number to call they leave you with 2 email addresses that do nothing. How is this app legitimate?
8461921950,2022-03-16 07:52:24-07:00,Brandon1868,1,Does not give refunds for accidents,"App seems okay. Customer service for the was quick, however when I found out I was enrolled for the lifetime plan and requested a refund I was in eligible. And it appears I may have been charged twice for the same membership on a credit card AND a debit card. I prefer MyFitnessPal."
8449144182,2022-03-12 16:07:17-07:00,Cam34777,5,Top notch,Best app in its class this side of La Jolla
8441207078,2022-03-10 11:02:58-07:00,kncknkcknanenadesvgh,3,Icon enjoying goody are,I just started with this app and that icon POPS ON every single time I click on something! Irritating!!!
8440549084,2022-03-10 06:53:27-07:00,Kaibab88&&&&,1,Rip off,"I paid a one time $80 fee for the pro plan. I figured since is was for the lifetime of the app it was worth it. However, I didn’t log my food for a few weeks, my profile was erased and now I no longer have the pro access. Don’t waste your time or money with this crappy app."
8412893809,2022-03-02 08:17:11-07:00,DebCook7,1,Tough to navigate,Would like it to be easier to navigate
8411014829,2022-03-01 19:28:24-07:00,mkone99,5,Best food tracking app,This is the easiest and most comprehensive food tracker I’ve used.
8381808171,2022-02-21 12:44:39-07:00,KTHealthy,4,Educate Yourself,"Educate yourself to what’s in the foods you eat. Don’t assume because it got the ok from FDA, it’s ok to eat."
8374660224,2022-02-19 15:14:18-07:00,78193652801657391,5,Great,This is an amazing app
8373814309,2022-02-19 09:45:39-07:00,Gray Beagle,4,Good and Simple,A good and simple application. Easy to use. Search feature could be better.
8372701926,2022-02-19 04:07:35-07:00,dated phone,1,Confused,Brand new and can’t figure it out after a couple days
8353041830,2022-02-13 17:01:12-07:00,Newjoy2912,1,Lost data,I am so upset! All my data is lost. I signed up & paid for premium service on 2/8/2022. I signed in today 2/13/2022 and all data is gone. Now I have a message to sign up for premium. I am beyond disappointed!
8352429782,2022-02-13 12:30:36-07:00,trial user 12345,3,"Basic free, must pay $80/year for what most want","Wanted a good carb tracker. After all the signup screens, loaded my first food and in order to see my carb intake, I am asked to pay for the premium version. 

Looks like a good app, but I don't meed all the coaching, etc. I just need a simple lookup to save the time of looking up the same info for free on Google."
8338999538,2022-02-09 23:08:47-07:00,Emsmy1luv,5,Best app for keeping track,"I’ve used this app off and on for several years now. The best app for counting calories and checking the value of ingredients in the foods you buy. I myself count calories and like to know what is really in certain sauces or prepared foods I eat. I love the scan barcode feature and the details you can read about the ingredients in the prepared things you buy. Hands down best app for staying healthy. I have tried others and always rely on this one for all of my info to a healthy lifestyle. It does so much more than even mentioned, and all within the free options of the app. Pretty stoked after 4+ years of using this app these features are still free."
8337620576,2022-02-09 13:07:57-07:00,XXXOXOXOXOXOXOXO,5,Great,A wonderful app that does everything I needed it for and more. The only annoying thing is how it repeatedly nags you to give it a review as soon as you start using it and before you get a chance to know if it’s good or not.
8307593349,2022-02-01 08:30:06-07:00,Lee_Mrtnsn,5,Repeat meals,"Update: Support advised about the option to save a “meal” that can be used for repeat meals.  Very helpful.

I eat a number of things every day (oatmeal for breakfast, ex) or for several days and there does not seem to be any way to either repeat an item or meal combination or copy and paste. I hope someone can tell need there is. I wrote an email to Support and received basic instructions on how to use the app (which was really annoying). Otherwise, I like the app. Good base of foods and easy to add or use similar. Simple too enter your foods and assign them to your meals."
8303770330,2022-01-31 07:43:27-07:00,John Jacob 27,3,Too complicated to interact with,I appreciate the bells and whistles of it but it’s difficult to interact with. Should be streamlined a bit.
8299486965,2022-01-30 04:35:02-07:00,cqk1701,5,So appreciative of Fooducate !!,"It’s real good important what we put into our bodies. That saying is true…you are what you eat. And now we have Fooducate that can give us the details of any food product.

Thankyou!!!"
8293186478,2022-01-28 11:22:52-07:00,pk9000@,3,New to fooducate,Like it so far but would prefer fewer requests to review! I’m hoping it’s not going to be a daily thing. Just don’t want the abuse.
8256836472,2022-01-18 20:25:27-07:00,bb12bb,1,"Wants me to upgrade, to what?","I can’t sample the upgrade, why would I want to do it?"
8236420797,2022-01-13 09:19:04-07:00,MelB218,4,Paid for the Fooducate Pet Premium Feature…. Now what?,"I was SO EXCITED when I saw there was a new feature for keeping track of your pet’s nutrition. Especially since I’ve been looking for an app that does this for a while now - I want to add supplements and Whole Foods to my dog’s food and would like to keep track of the nutrients I’m adding. 

Anyway, I’ve purchased it. Logged out and logged back in and I’m confused. How does this feature work? Can I add a separate profile to my account for the pup (that’s what I’d prefer). I found an article online mentioning a separate app for it, turns out it was an April fools joke?!?! I’m confused and beginning to wonder if I just got scammed out of $10."
8212269053,2022-01-06 15:40:55-07:00,Travonius,5,Amazing tool for weight loss,I can't say enough good things about this app. I have lost 30 pounds in three months by eating healthier foods using the app and measuring/logging everything.  Exercise is not required.
8201747099,2022-01-03 18:50:52-07:00,CrosbyBeck,5,Truly the best,A wonderful way to monitor your eating habits. Super easy to log the time you eat and even note how it made you feel after eating it.
8197477784,2022-01-02 15:46:01-07:00,Mamma B 3,4,Water update,"I really like this app. Slowly but surely it is keeping me on track so the health goes up and the weight comes down. 

My one big complaint is that the water intake is measured in cups. There is no other option. My favorite water glass is 20 oz or 2.5 cups. See the problem? I have to alternate logging 2 cups one time and 3 times the next. Not great. Most people don’t measure there fluids in cups but in ounces. Please update this great app so it’s more user friendly!"
8194188272,2022-01-01 19:15:28-07:00,teresa reaves,5,Great app for keeping you accountable!,I really like the ease of this app for adding my foods and tracking my calories.  I’m eating AIP (Autoimmune Protocol) and the chat feature is nice for talking to others that are eating the same way.
8184813012,2021-12-30 06:09:00-07:00,demonicly666,1,I have an allergy,"I was recently diagnosed with a gluten allergy, and I was hoping to be able to find some gluten-free recipes since I’m fairly new to the diagnosis. Low and behold you have to PAY for the app if you want any gluten-free options. Looks like I’m deleting the app and I guess I’ll just stick to Pinterest."
8161412089,2021-12-23 11:18:52-07:00,TotalxChaos,5,"So far so good, simple and easy to use",^
8140681433,2021-12-17 12:35:17-07:00,Max Biggavell,2,Impossible to find the food I eat,"Has a great motive to educate about the food you take in & how good it actually is for you. Tracks your habits & gives you suggestions to make better choices. However, it’s pointless when the majority of what you eat is not in the database. Trying to add your own is ultimately confusing & time consuming."
8107548792,2021-12-08 02:27:42-07:00,jcik$oijom,4,Calificaría 5 si la App se viera en español. Saludos,Calificaría con 5 si la App se viera en español.
8088510838,2021-12-02 16:19:58-07:00,Jason331891,1,This is not a free app,"Only tells total calories, not nutrient breakdown or any of the other important information you need with an expensive monthly subscription"
8013602197,2021-11-11 13:15:09-07:00,WmH2,1,Bar Scanning doesn’t work,"Had the app for less than 5 minutes before deleting it. 2 items scanned, 2 items wouldn’t focus and then the 5th one seemed to just being up an ad or something. I couldn’t figure out how to add it to the food that I ate. 

I have an iPhone 13 Pro with cameras capable of micro photography. I went back to my other app and it scanned all 5 items without effort."
8012848481,2021-11-11 08:21:33-07:00,kitcat3193,1,Misleading!,"The app says it is free, after you download it there is a cost for information that makes the app usable. I am uninstalling the app. Totally worthless!"
7997682369,2021-11-07 00:08:34-07:00,gnome8889,5,Okay,It’s working. Thanks.
7988738932,2021-11-04 11:17:51-07:00,aNNjjjJanNOOO,1,If you don’t stop asking me for a review,Every time I use this stupid app it always ask me for a review so here you go your app is whack your everything about you dumb app is whack god
7970656954,2021-10-30 09:19:48-07:00,poppa posey,1,Maybe the developer will try to make me feel like a jerk as well,I find this app worse than terrible. Everywhere you turn they want more money. I cannot find a way to work this as a free app and it is definately not user friendly. I would honestly give it minus five stars
7959626048,2021-10-27 08:24:51-07:00,Olduser1900s,3,Seems ok… but you have to buy…,"It’s sad that to be healthy you have to buy either expensive food or buy a membership on an app to calculate your carbs, sugar and etc…. So far it’s just a calorie calculator. Keeps track of weight n stuff and what you want to use. Meh…."
7935533285,2021-10-20 11:32:44-07:00,dr@g0n$t@r,1,Useless without buying upgrade,"This app ""said"" it had all the features I needed. What they failed to say it that 90% of the features people want and need have to be purchased in their ""premium "" package. For people of low income needing help with eating right it's hard enough these days to buy groceries let alone pay for a service to help them eat healthy."
7932576196,2021-10-19 14:48:26-07:00,NewTouchMom,1,Can’t use it …. Keeps asking for activation code,Very hard to use an app that asks for a nonexistent activation code
7932048816,2021-10-19 10:49:52-07:00,jojo's dog walker,3,First time user,My RD said this was the app to get. I use MyNetDiary and like it but she said this was more precise and designed by RDs. I got it but there is no page to add food or see the nutritional breakdown of the foods I eat. On the  one hand it appears to be a free app but then asks for big money if you want other stuff. I thought I’d use it before I invest but so far have no idea how to input foods and see what this app offers.
7918534457,2021-10-15 14:13:37-07:00,graymttr,1,Great concept but misleading,"I’m pretty aware of food ingredients already but I thought this app would make my life easier. Unfortunately I was left unimpressed with some of the explanations for the ratings they assigned. For example, I was eating some flavored almonds which I was sure would get a poor rating since the second ingredient are vegetable oils. Vegetable oils are highly inflammatory and overall terrible for you. The almonds got a B+. Next I scanned organic, lightly salted cashews with no flavors. They were rated B+. I think this app can make you feel like you’re eating healthy when you could be damaging yourself. Lots of room for improvement."
7907879292,2021-10-12 14:51:53-07:00,Lin Bar,1,Not User-Friendly for seniors.,I paid 2.99 for one month to see if this app is what I’m looking for.  I entered my profile & the app calculated my calorie intake. However I can’t even figure out where to enter the foods I ate today.  Every feature I want to use is an upgrade priced individually.  I’m not willing to be nickle-and-dimed just to see if the app will be useful for me.  I’m cancelling.
7878495581,2021-10-04 15:14:10-07:00,SHDJXUCHHEN,1,Hey there stupid!,"Time to rethink whoever is working on your email campaigns. Maybe don’t call your email subscribers stupid. I’m unsubscribing, stupid!"
7877428079,2021-10-04 09:21:45-07:00,Wazzup2001,1,Glitchy.,A lot of missing foods. The entry process is outdated and confusing.
7854364204,2021-09-28 07:12:16-07:00,Sweetieface1221,1,Refund,Does not work. Worst app ever. I want my refund.
7837528872,2021-09-23 11:15:45-07:00,Weizeil,5,Awesome!,Great information.
7792624874,2021-09-10 16:20:52-07:00,tiner9251,5,Does not sync with Fitbit,"How do I get a refund for this app. It doesn’t sync with my Fitbit. Just purchased Pro on the 6th of this month. 
I like this app to use when shopping. However, the scanner is slow. The my foods tab has no way of deleting foods. You are not able to edit after closing. For example, to add a photo of the food you created."
7771569717,2021-09-04 15:07:40-07:00,wkmingus,5,Regular Updates,They update their database regularly.
7764035363,2021-09-02 15:31:58-07:00,openedgates,5,Great,Very helpful
7755362290,2021-08-31 06:53:14-07:00,foodiewithabooty,3,Okay but not top of the line,"Their food base is low and it takes forever for the barcode to register. I have used Myfitnesspal for years, saw this and thought it was going to be a great upgrade for 1/2 the cost, but it wasn’t. Overall it’s an okay app, I just feel like the simplicity of Myfitnesspal (even the free version) makes this app frustrating in comparison."
7742171310,2021-08-27 16:33:12-07:00,TechSavvyGrannie,3,Waay too complicated to begin,"There are so many components and connections that if a user just wants certain ones, like I just want carbs and calories, it can’t be done. I already happily subscribe to Noom but it doesn’t offer carb counts. So I was willing to pay a monthly fee to Fooducate to get carbs. But to even get started, I have to answer a lot of current health status questions; I couldn’t skip any, otherwise, the app will send me notifications and reminders.  Boo, hiss, I program all my apps to stay out of my consciousness unless I summon them.  Next stop: My APPLE App Store account to cancel my subscription."
7739592128,2021-08-27 00:35:05-07:00,Pastazia,2,"Wanna like it, but …","I’ve tried many food tracking apps for over the years: MyFitnessPal, LoseIt, Simple, and a couple more but I can’t recall the names. I liked the idea that Fooducate had “grades” for different foods, so I decided to try it. 

I’m so glad I didn't subscribe or purchase the lifetime access yet, because this app needs work. It's not nearly as user-friendly as most of the other apps. The database of foods is not nearly as comprehensive as other programs. Editing diary entries, recipes, and other info is either not possible or difficult to figure out.

I will use the free version for a few more days to see if I just “don’t get it” but for now it's on my “wanna like it, but...” list."
7733053508,2021-08-25 07:24:04-07:00,Ksb923,1,Limited foods for logging,I can’t figure out how to request a refund. I bought the lifetime package on Saturday and am highly disappointed by the lack of foods available for selection in the database. There is no way for me to request a refund and almost the most typical things I want to log don’t exist. Try fitness pal first.
7718828435,2021-08-21 09:35:10-07:00,Heidi21183,5,Download it!,"I’ve had this app three weeks and I’ve already lost 7 lbs. It’s so helpful because it’s not just a calorie counter. It tracks all kinds of exercises, the value of the food you eat so you’re eating healthy while watching your food, and even shows you the additives in food you weren’t aware were there. I even bought the subscription, which I never do, and I don’t regret it one bit. Love this app."
7715493124,2021-08-20 11:46:40-07:00,RamaLamaDingDong55,1,Up sell,This might be a great product but every time I clicked on anything useful I got a “Premium Version Required” which means a monthly payment. This became so annoying I deleted the ap.
7693376598,2021-08-14 15:12:39-07:00,GoodOmens42,1,Probably a good app…but…,"Probably a good app, but I bought it and “rate me” popped up 3 times so far in 10 minutes of trying to find out…so 1 star?"
7654632543,2021-08-04 08:46:58-07:00,tygamerforce,4,Good app but four star,So I bought it for a lifetime of 90 dollars it doesn’t make sense for me to buy it for lifetime for another $39.99 to add on the gluten free switch if you are going to ask for it for a life time the button should have been included
7628180312,2021-07-28 09:33:03-07:00,mermaidyoga87,2,Scanner doesn’t work.,"I was super excited to buy the year membership for all the nutrition tracking. However, the scanner NEVER works!! So annoying! I enter the barcode and nothing shows up. I enter the name and sometimes it appears. FIX THE SCANNER."
7626565448,2021-07-28 00:24:12-07:00,Gear77;),5,Love it,Great app!
7617694454,2021-07-25 14:14:47-07:00,Another app store user,3,Uses Imperial Units,Uses imperial units with no obvious way to switch to metric units. Put me off so I didn't even want to look at it further. // Clarification after developer response: Uses imperial units for my weight and height during setup of the app; I didn't even get past that to look at food items.
7601237035,2021-07-21 04:18:46-07:00,Pogose,5,Best app to have when grocery shopping,I have used this app over the years to refine my grocery shopping when I start getting a little lose and the food company’s get more creative.
7599646298,2021-07-20 17:45:04-07:00,birdieky,5,Helpful,Excellent resource when you decide to purchase a processed food
7580838420,2021-07-15 15:40:15-07:00,Foynt,3,Just fine,"This app is nice because it’s not explicitly a weight loss app, but I personally feel like it doesn’t live up to its promise to educate your food choices. There’s also a number of things that are for premium members only. I suppose I like it better that way because that makes the app free for me, but it’s also frustrating because that impacts my full nutritional picture and as someone who isn’t gluten free by choice it adds an unnecessary extra layer of effort for me"
7560869316,2021-07-10 07:19:23-07:00,Heart-dude,5,Heart-dude,"Just started!
Hoping to learn healthier eating habits!🍴"
7550728432,2021-07-07 13:52:51-07:00,Nana DeMar,5,Best calorie tracker,And I’m an old-school calorie counter and this site here offers a ton of products the ability to add products and meals to keep track of every single meal I can plan a whole days food and stick to it I know exactly where I’m at calorie wise big thumbs up!
7535304861,2021-07-03 10:06:36-07:00,Connor557,1,Won’t stop asking me to review. Dumb move,Won’t stop asking me to review every 30 seconds. I would suggest you fix this
7519834201,2021-06-29 09:37:33-07:00,Cazoi,1,Not easy to use,I’m trying to figure out how to log what I’m eating and this is not easy. Lots of ads. I don’t know if it’s better if I buy the premium version but I’m hesitant because it’s not as intuitive as other apps
7516896182,2021-06-28 14:33:45-07:00,keepstrongkid,4,I don’t like choosing my gender as “guy or gal”,"First, if you’re asking in order to get metabolic information, then you are asking my sex. Sex ≠ gender. Second, please stick with male or female, and if you want to be inclusive, add intersex."
7479633797,2021-06-18 12:59:53-07:00,rdmck32!,5,Review,"Good healthy tips!
My new reference."
7477839535,2021-06-18 02:46:18-07:00,WorkerBmaniac,5,A wealth of information.,I really appreciate the varied levels of information that can be derived from just the single input of one barcode. You present the facts and that’s what is always needed when our desire to improve our health is of tantamount importance. Bravo.
7463739759,2021-06-14 06:04:18-07:00,Lia Gillette,5,Great app,Love this app however I have ran into the issue where I added a food that I could find and I mis entered one of the numbers on the label and now I can’t figure out how to delete it from the my food page
7460780219,2021-06-13 10:00:57-07:00,indraspective,1,No response from support!!!,"I wanted to track magnesium and omega 3’s among other micronutrients and as soon as I downloaded the app and found out that it only tracks a few micronutrients, and not the ones I specifically wanted I contacted support via the app requesting assistance (maybe it was user error) or a refund. I got no response. I’ve scoured the app and it simply doesn’t track very many nutrients. I sent another message a week later and still have gotten no response."
7436958667,2021-06-07 05:03:17-07:00,3rd time WW,1,PAid but no service,I need refund this app doesn’t work
7422061621,2021-06-03 08:15:02-07:00,Your Majesty 408,1,Bad update go back to old style,This newer updated version is less helpful.  They should put back the ingredients page where they listed it in a column & rated the safety of each individual ingredient & had side notes on the reason why it was rated good or bad with the potential harm & what to look for.
7415285137,2021-06-01 14:25:15-07:00,camom80,3,"Pretty good, but missing GI...",Like this app and it’s recommended swaps but it would be super helpful to add a glycemic index rating too or add it into the explanation section. It’s a crucial component for so many on a specific diet! If that was here combined w/the scanner it would be perfect!
7409784754,2021-05-31 06:22:14-07:00,Grannie Nan,4,Food search,Little challenging at times and sometimes slow not all foods in it but it’s helpful for learning about better choices
7388987014,2021-05-25 20:31:34-07:00,gig1234077,5,I’m already loving this,"Well I’m new to this app first off second off I really think this app is gonna help me to 1 have better sleep. 2 improving my moods and finally to lose weight I wanna lose weight to be healthier and feel good about myself, I highly recommend others try out this app it’s absolutely amazing!."
7388380395,2021-05-25 16:26:09-07:00,Autumn Nolan,5,Weight loss journey,This app has made my life so much easier! It’s truly the best app out there for people tracking they’re weight loss and calories and all of that stuff. I do not have much knowledge about this sort of thing and I’m new to the world of healthy choices but this app is going to become a vital part of my success. Thank you so much!
7384249377,2021-05-24 16:18:24-07:00,Destructerator,5,Cute icon!,"Functional application, neglected it a bit too much :("
7379768958,2021-05-23 13:55:20-07:00,Paul Troon,4,Fantastic,"I love this app. I have no experience with earlier versions. It is quite the handy device as long as the nutritional information is correct and as long as it is not “corrupted” by commercialism. I would hate to think that producers could rate their product higher. But there is no evidence of that so it is fantastic!!

If I had to make one change it would be store specific. For example if I am in a Kroger looking at Kroger brand peanuts then the list that offers a healthier alternative shouldn’t list a Target or Walmart product first. Not saying they shouldn’t be listed just not first. Heck, I am in Kroger why do I care what Target has?  

Great app."
7346382613,2021-05-16 07:45:43-07:00,Krafty Carolina Girl,5,Promising,Looks promising but time will tell!
