id,date,user_name,rating,title,content
13246625175,2025-10-09 20:08:36-07:00,edijcn,1,Create a food,It won’t create a food. It just loads for 20 minutes.
13222262690,2025-10-04 05:20:58-07:00,Aly tely,1,Horrible,I tried to sign in and it didn’t let me because I’m 10 that is so whack. I’m never downloading this app ever again. And also most of the reviews are negative.
13206082828,2025-09-30 12:43:03-07:00,NYCS Trainutt,5,Great Meal Tracker,"The free version is very good for tracking snacks, water and meals with easy input functions, plenty of items in the various library categories and restaurant items as well. 

A little less “buy premium” popping up every time you “touch a crown” 😂 would be nice but the app is free after all. 

A setting option for a 24 hour clock instead of AM/PM would be terrific, all in all it is an easy to use friendly formatted app."
13173978348,2025-09-23 04:44:33-07:00,Recipe lover,1,Expensive membership lost,Paid around $100 for a lifetime membership and they lost it
13172386208,2025-09-22 18:28:30-07:00,Zaronology,2,"When the macros are wrong, which is very, very, very, very often","When the macros are wrong on a food, you have to input the entire thing all on its own. That wouldn’t be such a pain, as other apps do it, but those other apps typically let you copy the same information over and just adjust what you need for your own records. with this one, you have to submit the information with a picture, which is just absolutely ridiculous. It is so inconvenient and waste so much of your time to use this app. The more basic apps will suit you much better if you’re actually doing this on a daily basis. I thought that this app would give me more reports and things that would benefit me, I was wrong. 

The user experience on this app is very clunky, time consuming, and not intuitive. I honestly don’t understand how this app has such good ratings, unless it’s audience has never used a different type of app. None of them are perfect, but where they are not perfect they make it easy for you to make adjustments on your own without having to wait days for them to update the food for you to get an idea of what you’re really consuming. Other people may not take their diet as I do perhaps, but since I’m putting in the effort to do it anyway I wanna know down to the proper calorie, not have to make estimates or waste time having to do manual inputs because their data is an accurate."
13159585813,2025-09-19 20:29:25-07:00,cupcake rainbow girl 18,1,Wouldn’t let me use,"I was just downloading and app and inputting my info when all the sudden, after I put in my age a message pops up saying “you can’t continue to use fooducate”. The issue is, the App Store says it’s 17+ and I’m 17, almost 18. And I put in my birthday correctly. I tried swiping out of the app, I tried redownloading it and restarting my phone. Not sure what the issue it"
13146156954,2025-09-16 15:30:52-07:00,Beware this app isn’t great,1,Don’t count on the free trial,Was charged right away and didn’t get the 7 day free trial
13074683796,2025-08-29 07:25:14-07:00,Duhvhhb,1,Add new products,App won’t let me send the email when I want to add products that are not scanning
13038058700,2025-08-19 22:42:19-07:00,SadieKay14,1,CUSTOMER SERVICE NON RESPONSIVE & CAN’T OPEN APP FOR 6 WEEKS!!! 🤬,"UPDATE: 8/19/25
This issue remains unresolved, a total waste of money for the app, and total waste of time with customer service for no solution. 

UPDATE 4/28/25: 
This is my MOST RECENT email to customer service, sent today -

“Hello??????!!!!!!! 
I’ve left a negative review for you guys weeks ago, and I have been waiting for a response for weeks for you to solve my technical problem so I can use the app again. Since this is taking WAAAAAAY too long, I want a refund immediately, of which I asked for on the 13th with no response, and it is now the 28th. I am going to continue updating my negative review in the App Store until someone responds and provides a refund.”

4/12/25: 
I’ve literally been waiting three weeks for Customer service to fix an error message that is popping up saying that I’m not connected to a network, which is incorrect. I am. It won’t let me log into the app and I just re-purchased this app a couple months ago. I’m gonna be finding another one and requesting a refund if I don’t get my refund I’ll update this review."
13028113734,2025-08-17 10:27:24-07:00,ViViCooks,4,Worked but not very big catalog,"This is a very good website, however most of the food I logged was user-added, and the qr-code scanner doesn’t really work."
13008368717,2025-08-12 15:05:11-07:00,HDSG2016,2,Not accurate,The database is full of errors. I have reported a few and they still haven’t updated it
12979344911,2025-08-05 08:16:15-07:00,ListenToughGuy,1,Don’t download,"Everything is behind a paywall. Useless without paying. Not worth the cost. Basic functions available in other apps not available here. Food ratings are arbitrary and not based on true science.  Use Samsung health instead.

Edit: their response to this is both very generic and meaningless. They couldn’t even be bothered to write a real response."
12978899665,2025-08-05 06:11:50-07:00,toppingj,3,Used to be great,"I’ve been using Fooducate for years, about 3 days ago all of sudden it will not connect and I can’t access my account. Just keeps asking me to try again. I reached out to support and will update this review once they respond. For now I’d say don’t bother downloading it through the App Store.
UPDATE 2025-08
App is working again. It seems the VPN built into my iPhone is causing the issue. I’m not sure how to feel about an app knowing it only works when the VPN is disabled. I’m glad the app works but also feel like it’s at the expense of my personal device security and safety. I’m not sure why after 3 years this now an issue."
12959637429,2025-07-31 10:03:20-07:00,Follow Reach Records,3,Great Start but,This app has most of the features that you could want but the missing restraint food and items are tough to overcome. Also some of the nutrition scoring is frustrating. Most nutrition coaches would say a less sugar fairlife protein drink is better than a premier protein but fairlife is a D or C+ while premier was a B. There were other confusing score values as well. I tried to submit feedback in the app but the app is also didn’t let me complete that process and just said I needed to set an email? Which I had already in my account?
12931880344,2025-07-24 12:10:10-07:00,Unidirectional Velocity,1,Infinite potential but completely missing core element,"This app does have great potential of taking away a vast part of the market share. However, when it comes to adding the missing nutritional information from so many various food items that are missing from your database, it is extremely frustrating that you ask to send the photo of the nutritional labels via e-mail to be addressed at a later time by someone else, who does that these days. It should be addressed immediately via A.I. tools being implemented right within the app so that it can immediately extract all necessary nutritional information right from the user’s photo of the nutrition label, instantaneously reflected in real-time basis. Please get with the trend and keep your app capable; otherwise, new contenders will literally turn your app completely irrelevant, then no one will use it, period."
12927529021,2025-07-23 10:31:16-07:00,rsunka,3,Good App but need works,"The food database seems to be limited with my having to add more manually then pick from the list.

The UI is pretty clunky overall and could use an overhaul to make it slick and modern."
12892197288,2025-07-14 15:03:56-07:00,Lou Riolo,1,Not free,Got up because it said it was free and it's not. Don't waste your time unless you wanna pay.
12856219870,2025-07-05 10:32:44-07:00,Vegas Dave #1,5,Exceptional guidance,"With Fooducate’s Excellent food library, scanner and counter, coupled with a small food weighing scale and determination are all you need for success!"
12841160012,2025-07-01 16:20:33-07:00,Jody1612,4,Not Bad…,"It’s nice to be able to keep track of what I eat in order to have more control of my habits. However, I don’t always get to enter what I ate until the end of the day and the app does not seem to let me change the time I ate each item. So everything I eat in a day gets entered as if I ate it all at 7:00pm."
12840107452,2025-07-01 10:17:19-07:00,Horrible Upgrade!!!,1,Horrible App,This app can’t find foods on a consistent basis.  Half the time you can’t find the grocery tab.  What a waste of time.  My Fitness Pal is a far better app.
12816600451,2025-06-25 12:01:03-07:00,Yaslicious,1,"Like most, it spies in you","This app used to be great, but I stopped using it for a while and now that I started using it again, it keeps saying that there is a network error. To make sure I am connected to WiFi or cellular service. It is, but the problem is that I ALWAYS use a VPN. They hate that because it makes it a lot harder for them to track us and spy on us. Many unscrupulous companies (I don’t know about this one) claim that they don’t allow VPN’s because of security concerns. What a load of you know what. VPN’s increase your online security by encrypting your online traffic. And that is why they keep telling people to use a VPN while using a public and unsecured internet connection. Such as the WiFi connections at markets, stores, coffee houses, airports and bus terminals, and so on. But it also interferes with companies ability tracking you and your device. No tracking, no selling of your personal information and that means less money for the greedy developers."
12794747231,2025-06-19 18:49:23-07:00,cdsal_99,1,"UPDATE YOUR APP PLEASE, THANK YOU",It’s really buggy and I can’t use it.
12792640022,2025-06-19 06:31:21-07:00,nickainohio,2,Half a good app,So few foods are included that use of the app is handicapped
12788727734,2025-06-18 06:16:49-07:00,Terribleshy,2,"Glitchy, no customer service",The app never synched and I sent a support email right away but no one ever responded but still was charged.
12773367610,2025-06-14 06:29:43-07:00,Tenerbeaner,4,This has been a good App but,"This has been a good app, but I do wish you would give the option to take a pic of my plate to scan home made food to get a better idea of the calories on the portions and to save for my meals. The current meal label doesn’t have enough characters the list all the foods on my plate."
12709774689,2025-05-28 18:02:34-07:00,Micahadair,1,Don’t get taken!,So I checked my Apple account… was charged $35 for this app not sure how?! I downloaded it months ago have t used since didn’t find it helpful! Beware when they get your info they use it… so a yr subscription I cancelled but eating no pun intended $35 for nothing!
12669814058,2025-05-18 05:40:52-07:00,Quentin8909,1,Very lacking,"Lacking, they charge you for macro analysis but they have incomplete and/or inaccurate information. And it takes them months to implement the information you provide for the product they don’t have."
12666813928,2025-05-17 09:37:32-07:00,Jamel11234,2,Time for an upgrade,Isn’t it time that you had AI capabilities so that all we need to do is take pictures of the food instead of barcodes
12629714265,2025-05-07 07:08:50-07:00,bandobear919,4,"great app, needs some minor tweaks","i downloaded this as an alternative to MyFitnessPal because all that app has done is make me feel bad about myself. i don’t get that feeling with this app. there is a paid version (that i do not have) but the food scanner is free and it is super easy to create your own food items. my one issue with this so far is that it only records calories burned if i am starting a workout on my watch (ie lifting, going on a walk) but doesn’t transfer all of my “move” calories"
12569059796,2025-04-21 05:30:13-07:00,Camarodimasi,1,Didn’t even get in,I don’t often leave reviews. But this app made me mad. If it’s “completely free” to register and “my card will not be charged” then why don’t need my credit card information?
12563399993,2025-04-19 15:40:39-07:00,hornnic,1,ad infested,"redownloaded this after a few years and I guess they got bought out by some giant company, sad to see that the app now is just covered with ads and trying to push you towards their premium plan, a shame and I will be looking elsewhere for food tracking apps"
12540369030,2025-04-13 17:02:35-07:00,coco030815,3,Great concept but not fully executed,Not worth the paid version. Most of the foods I scan do not show up. Then when I try to send the email with pictures the email does not work. Leaving me with the inability to add key foods I eat everyday. I paid for a full year and plan to request a refund since I can’t use the app fully.
12515456265,2025-04-07 10:10:08-07:00,hmh5432,1,Did not honor lifetime subscription purchase,No way for company to look up past lifetime subscription purchase and app has been reset.
12499264346,2025-04-03 09:51:04-07:00,DoolittleH,1,Scam,"Tried the free trial, didn’t like the app. Canceled after selecting the weekly charge and it still charged me the full years subscription ($34.99) which is unacceptable. Don’t bother with this app"
12460991023,2025-03-24 18:32:24-07:00,Hgfjjdgjknctyb,2,Background Activity Tracking / sharing your activity with 3rd parties,Most recent update has added features that share your activity with 3rd parties such as appsflyersdk. Unfortunate because their app is awesome but now sends our data to 3rd parties.
12452520151,2025-03-22 17:27:21-07:00,Bsinj,1,First experience,Useless - cannot read apple barcode
12425926533,2025-03-15 20:40:27-07:00,"cghtgtcgt,chyhy",5,Easy to use and easy to read,Really love to use this app when I’m trying to be more serious about tracking my diet and exercise.
12421561462,2025-03-14 19:08:27-07:00,Truthtellerbtellin,4,"Chronometer but cuter, however",So I downloaded this app because it showed more features in the ad than it allows you in the interface. Chronometer also has tools like intermittent fasting tools but doesn’t integrate with my apple watch..can’t decide whether to keep this or not
12412763926,2025-03-12 11:47:40-07:00,colecurtis,1,Waste of my time!!!,Tried using this can’t find any of the products I use so not accurate in counting what I’m eating!!!!
12401261401,2025-03-09 10:13:08-07:00,evecam16,1,Cuidado es spam,Es spam no lo descarguen :)
12398979743,2025-03-08 19:35:40-07:00,MiChelle Scrimpsher,1,So frustrating!!,Half the features are hidden behind ads for games that can’t be deleted. Ap is useless.
12390765654,2025-03-06 18:38:11-07:00,Shutupntrack,5,Fooducate,"You cannot cancel it, thus it’s terrible!!"
12381569826,2025-03-04 08:49:12-07:00,Dee__wade,5,Great! Even without the premium version,"Great for getting a good idea of how healthy items you have or are having are. Most things just take a barcode scan and there’s all the info in a digestible (no pun intended) layout.

Amazing for how easy it is to keep track of calories/nutrition and other dietary needs you have throughout the day.
I was worried I’d need to drop 9.99 a month or whatever just to use this 

But keeping track of snacks or foods (drinks too) usually is just as easy as scanning the barcode or searching the food, then adding it to your list of eaten items for the day."
12377491589,2025-03-03 07:06:53-07:00,MsChyD,1,Been using since 2011 now need to subscribe,I’ve been using this app since 2011.. now i need to create an account and subscribe.  No loyalty to faithful long time users.  I never created an account because it wasn’t necessary back then but I did find two emails that I sent requesting to add food to the database in 2011 and again in 2014.  I feel as if i should be grandfathered in or something since I’ve been using it so long. Not I’ll have to look for another similar app that’s affordable.
12341272109,2025-02-22 04:43:23-07:00,JTNinetyNine,4,Dark Mode,"I like the app, wish it had a dark mode"
12334767188,2025-02-20 12:08:10-07:00,iJasso76,1,Scam,They claim you can get a free trial then charge you for a full year and when you request a cancellation right after they scam you they deny it 😒
12310340618,2025-02-14 08:13:55-07:00,Annoyedafgd,1,App privacy settings,Don’t try to be tricky with your privacy settings with an ambiguous toggle switch.
12307378352,2025-02-13 13:16:17-07:00,@Vegasroach,3,"Looks good, but macros are behind paywall","I would absolutely use this app if the macros were not paywalled. Other apps show you your daily macros for free, and that’s just enough to keep me using my old app. If this changed I would swap over to Fooducate immediately."
12275160066,2025-02-05 12:59:47-07:00,Tgarciabates,1,Age,Before you download an app it tells you the age the app is meant for. This says 17+. I am 17 and it will no longer let me access the app. Ridiculous.
12274041719,2025-02-05 07:05:19-07:00,,1,Will keep you accountable but flawed food scoring system,Food scoring system rates ultra-processed chocolate ice cream as a green B-. Take out your bias food scoring system
12260718264,2025-02-02 01:11:41-07:00,Jane Doe Esquire,5,Great for Accountability!,"I have been using the paid version of Fooducate on a daily basis since April 2024. With permissions, it can read weight and exercise from other apps and automatically adjust my daily target calories based on these, provided the weight target and weekly target loss (or maintenance or gain) is set up in my profile. The app is so simple. The automatic calculation of how many calories I can eat in real time is great!  As soon as I exercise and the effort is recorded by my smart watch to my health app and read by Fooducate, I know how many calories I have “earned”, no calculations or point counting needed. Similarly, as soon as I weigh myself and the weight is recorded by my smart scale to my health app and read by Fooducate, my daily target calories are automatically adjusted. Trying to get an “A” on healthy eating also incentivizes me to do better. I have lost weight using Fooducate; it has become a key tool in my healthy transformation toolbox!"
12179212408,2025-01-13 04:44:50-07:00,IzChik,4,Overheated my phone,"I used this app for about two weeks. I started to notice that within about 15 seconds of having the app open my phone would get really hot. I don’t know if this meant the app was unsafe malware/mining in the background or the app needs further development. Either way I uninstalled. 
Otherwise I enjoyed using the app. As with most it took a day or two to get the hang of it. I just wanted an app where I could hold myself accountable to my food intake. So the food ratings and average rating of the day were just bonus."
12148279291,2025-01-05 07:33:09-07:00,WendyParker0472,3,Ability to delete recipes,"This is app is very helpful. However, there is no way to delete recipes that are created. This is a feature that needs to be added."
12117032640,2024-12-28 12:21:08-07:00,AshishBit,1,Forced Subscription after trial,Do not do the trial if you forget to cancel they will force the full year membership on you
12094119949,2024-12-22 13:12:13-07:00,Whalenutz198st,3,Data base lacking,"The app feels extremely dated and the database of the food they have in here is very limited I submitted many products I use that other apps calorie counter has I hope , you can do better."
12059872940,2024-12-13 13:20:57-07:00,badkitty_,1,"Fooducate website is useful, its app is not. Just use the website instead.","I gave it another shot. This time I used Apple to create an account to avoid giving them personal information. FYI, the app is not nearly as useful as the website. I could not find anywhere to search for foods. Just stick to using the website.

ORIGINAL REVIEW:

Like the website, hate the app

I downloaded this app because I like the website. But the app immediately began prompting me for personal information. Height, weight, age, etc. I did not fill in any of the information. 

I clicked on the word “skip.“ Even though I clicked on “skip,” it still filled in personal information for me that it obtained somewhere ***without my permission.*** The information was accurate and appeared to be coming from the Apple Health app even though I had ***not granted this app access to the Health app.***

I then discovered I was forced to create an account just to view nutritional information on foods. I decided to immediately stop using the app. I guess the developers felt like although they had a good thing going with their website, why not use their app to collect as much personal data as possible, even for people who have no intention of using the app to track calories."
12050654406,2024-12-11 03:50:31-07:00,rctii42,1,Crashes every 30 seconds,"Don’t bother, it’s not an app ready for launch. It turns off before you can enter a whole meal ."
12026222191,2024-12-04 14:37:20-07:00,MyPotatoisHot,1,Save yourself the annoyance.,"Just bought this app not long ago & immediately regret it. Just use one of the others.

The app closes after EVERY. SINGLE. ENTRY. I mean, enter in 1 slice of chicken, closes out, go back in and enter 1 apple, closes out.

I then sent a support ticket & they told me they weren’t going to do anything until enough others are sending in support tickets for it even while the community discussion page has MANY people complaining about the same issue.

Let’s not forget, their search function is…… antiquated to be nice. Like the functionality of it hasn’t been updated in years."
12024948125,2024-12-04 07:11:47-07:00,Dinofuel,1,Fooducate app crashes when adding a food item,Fooducate App crashes when adding a food item on my iPhone. Have deleted the app and reinstalled but did not resolve the issue.
12022527378,2024-12-03 14:53:24-07:00,NolaG,1,Paid subscriber tired of crashing app,"I am a paid subscriber and have been for several years. I appreciate the app for what it does in terms of simplifying understanding what we’re eating. It’s not always accurate with the grades, but that’s okay. 

I began using the app for tracking food and macro and micro nutrients. Have loved it. 

After the last iOS update the app began crashing nearly every time I input an item. That’s 30-50 crashes a day which is all time I’m wasting. 

I will have to switch apps and cancel my subscription if this issue isn’t resolved."
12019803207,2024-12-02 21:44:15-07:00,Jteblum1,1,Keeps kicking me out of App,"Every time I add a food item to a meal it kicks me out of the app. Aside from that the app has been pretty good and I like how it goes into majority of the nutrition like vitamin d, potassium, calcium, sugar, etc. , except I don’t like getting the popup ad even when I’m on a paid version. Please fix or just refund me. Thank you"
12019384729,2024-12-02 18:41:30-07:00,Sarena4star,3,Almost there!,"Somewhat glitchy. Shuts down every time I log. Would be better if you could click your grade or your nutrient analysis and see what foods contributed to them so you know what foods you should lighten up on, which ones had too much salt, etc."
12014562520,2024-12-01 11:55:03-07:00,missfortunate34,3,Bug needs to be fixed,I love this app and it is so helpful! However there’s recently been a bug that makes the app crash every time I add a food from the search bar. If you scan to add a food it doesn’t crash. Just wanted to bring this to your attention!
12011291986,2024-11-30 17:14:31-07:00,Dennisthepennis,1,Keeps crashing,I like the app and it is easy to use. However it keeps crashing every time I add a food item. Please fix!
12011129772,2024-11-30 16:13:26-07:00,KrStratton,3,Great until update,This worked wonderful until the most recent iOS update and now it exits every time I track a food. Uninstalling and reinstalling didn’t help either 😟
12003785182,2024-11-28 20:24:48-07:00,Twilla_M,2,App Issues,Please fix this app. It keeps crashing while using it. I can’t even add a food item without it crashing right in the middle of it!
11997425658,2024-11-27 04:19:42-07:00,JenkinsWallus,1,Crashes,"Every time you enter a food item, the app closes automatically. Annoying to have to reopen the app 5 times to enter 5 things."
11993963654,2024-11-26 05:36:57-07:00,Bill28226,1,Fix the app,App closes whenever I add a food.
11979836992,2024-11-22 11:51:53-07:00,_schulenburg_,4,App problem,"When I hit “Done” after entering my sleep or my food, the app shuts off instead of getting me back to the daily diary."
11973542273,2024-11-20 19:33:56-07:00,AmityJay,1,App Crashes,"The app crashes every time I try to enter food. I would love to give a five star rating once this is fixed, cause otherwise this app is great!"
11964007915,2024-11-18 05:18:58-07:00,Colorful but that’s it,1,Food not in program,There are too many items not in the system. I try to eat healthy items and they’re not there most of the time
11961272913,2024-11-17 10:02:14-07:00,MommaPorter,4,Works great for weight loss,Works great when it works. Lately has a glitch that has not been fixed yet.
11954764475,2024-11-15 18:15:35-07:00,jlagnese,1,The don’t fix it,I’ve had problems with Apple Health not updating from Fooducate and put in a few support tickets and it just gets worse. It hasn’t updated for 6 days now and they can’t figure it out or won’t. My guess is there’s something wrong with their database.
11941516180,2024-11-12 05:04:04-07:00,tinagail42,3,Crashes,This used to be excellent app crashes every time I enter a food. Looking for an app with these features that doesn’t crash.
